{
  "schema_version": "lab.suitability_decision.v1",
  "decision_id": "SUITABILITY-001",
  "target_id": "target55",
  "workload_id": "pi4_representative_smoke",
  "policy_id": "pi4_default_policy",
  "overall_decision": "marginal",
  "selection_ready": true,
  "dimensions": [
    {
      "dimension": "thermal",
      "decision": "marginal",
      "requirement": "thermal_max_c <= 75.0",
      "observed_demand": "72.0C target-conditioned response",
      "target_envelope": "run-backed target thermal evidence",
      "margin": "3.0C",
      "confidence": "medium",
      "target_conditioned": true,
      "portable_between_targets": false,
      "evidence_refs": [
        "artifact://lab/runs/LAB-RUN-workload-001/reports/workload_demand_profile.json"
      ],
      "unknown_reason": null,
      "next_evidence_needed": []
    }
  ],
  "blocked_claims": [
    "production readiness",
    "real-time safe under all pressure"
  ],
  "data_quality": {
    "degraded": false,
    "missing": [],
    "notes": [
      "suitability decision read target run numeric evidence and target operating contract rules"
    ]
  },
  "evidence_refs": [
    "artifact://lab/runs/LAB-RUN-workload-001/reports/workload_demand_profile.json"
  ],
  "time_unix_ms": 1780000000600
}
